<!ELEMENT biblio (livre+)>
<!ELEMENT livre (titre,auteur,annee,genre,prix)>
<!ELEMENT titre (#PCDATA)>
<!ELEMENT auteur (#PCDATA)>
<!ELEMENT annee (#PCDATA)>
<!ELEMENT genre (#PCDATA)>
<!ELEMENT prix (#PCDATA)>
<!ATTLIST prix devise CDATA #REQUIRED>
